id,title,author,dateofcompletion,feedback,ratings,isbn
1,"Shouts of Nothingness
",Tsai Chih Chung,2025-08-26,"A collection of simple, wise Zen comic stories by Tsai Chih-chung that are praised for their deeply philosophical content and lasting thoughts, with readers often recalling them from childhood. Reviews highlight the comics as a beautifully simple and deeply wise medium, with some fans considering it a great Zen comic.
",4,0385472579
2,Raider from the north,"Rutherford, Alex",2025-08-27,"It is 1494 when the ruler of Ferghana dies in an extraordinary accident. His son, twelve-year-old Babur, faces a seemingly impossible challenge Young Babur is determined to live up to the example of his great ancestor, Tamburlaine, but he is dangerously young to inherit a kingdom.",3,0750532726
6,The Alchemist,Paulo Coelho,2025-08-10,"The Alchemist details the journey of a young Andalusian shepherd boy named Santiago. Santiago, believing a recurring dream to be prophetic, decides to travel to the pyramids of Egypt to find treasure.",5,0061122416
7,Rich dad poor dad, Robert T. Kiyosaki,2025-06-11,"Taking to heart the message that the poor and middle class work for money, but the rich have money work for them, the author lays out a financial philosophy based on the principle that income-generating assets always provide healthier bottom-line results.",2,1612680178
8,The Nightingale,Kristin Hannah,2025-06-25,"Despite their differences, sisters Vianne and Isabelle have always been close. Younger, bolder Isabelle lives in Paris while Vianne is content with life in the French countryside with her husband Antoine and their daughter. But  Antoine is sent off to fight and Vianne finds herself isolated so Isabelle is sent by their father to help her.",2,1250131766
